{
  "contract_version": 1,
  "retrieval_id": "3caac836-9589-4540-a076-714eb647dddb",
  "request_id": "8f8da0c8-ae89-4ddb-bcf6-4f312fa69582",
  "evidence": [
    {
      "evidence_id": "0c364399-5307-5a9d-842d-d323a2e98ae6",
      "knowledge_document_id": "417070e0-403f-4dd5-a3c8-ae8f16e0c6c4",
      "knowledge_document_version_id": "50a7f1ae-0b4f-4dc4-b33c-604df996334a",
      "chunk_id": "70ad4d75-ac68-52ad-adad-48e85c2d263d",
      "content": "The policy introduces a new disclosure requirement.",
      "score": 0.91,
      "rank": 1,
      "title": "Market policy update",
      "source_uri": "https://example.com/policy/update",
      "source_app": "knowfeed-app",
      "source_document_id": "83bb7926-47f0-4262-8215-27da1cc1e681",
      "source_document_version_id": "359ea32d-90b3-47e4-9168-930bfb768d0d",
      "content_hash": "d5e88ee6a2f80b367f23aa4aa82a1c0c7be25a774dc91f8b66737d01a4748cc7",
      "token_estimate": 52,
      "truncated": false,
      "access_scope": ["tenant:sunmoonai"],
      "provider_metadata": {
        "provider": "ragflow",
        "term_similarity": 0.82,
        "vector_similarity": 0.94
      }
    }
  ],
  "total_candidates": 1,
  "truncated": false
}
